{
  "schema_version": 1,
  "id": "installation",
  "summary": "Development-profile installation and read-only source comparison.",
  "owner_paths": ["scripts/install_development_skills.py"],
  "provides": [
    {
      "name": "development-profile",
      "kind": "cli",
      "summary": "Install predefined skill packages, managed shared files, the profile guide, and the marked instruction block; --check compares without refreshing.",
      "declarations": ["scripts/install_development_skills.py", "tests/test_install_development_skills.py"]
    }
  ],
  "artifacts": [
    {
      "name": "profile-membership-and-dependencies",
      "summary": "DEVELOPMENT_SKILL_SOURCES, PROFILE_SKILLS_README and SHARED_SCRIPT_FILES define the managed installation set.",
      "declarations": ["scripts/install_development_skills.py", "skills/README.md"]
    }
  ],
  "invariants": [
    {"statement": "Replacement is limited to selected packages, explicitly managed shared files and guide, and the marked AGENTS block; unrelated content is preserved."},
    {"statement": "An active installation is distinct from editable source and is not refreshed during an ongoing agent run."}
  ],
  "depends_on": ["runtime-evidence"],
  "module_docs": ["README.md", "skills/README.md"]
}
